{
  "schema": "cogeval.model_capability_catalog.v2",
  "updated_at": "2026-06-29T00:00:00Z",
  "interfaces": {
    "openai_responses": {
      "thinking_effort": {
        "surface": "thinking_effort",
        "path": "reasoning.effort",
        "vocabulary": [
          {
            "id": "default",
            "wire_value": null,
            "display_name": "Model default"
          },
          { "id": "low", "wire_value": "low" },
          { "id": "medium", "wire_value": "medium" },
          { "id": "high", "wire_value": "high" },
          { "id": "xhigh", "wire_value": "xhigh" }
        ]
      }
    }
  },
  "models": [
    {
      "model_id": "gpt-5.5",
      "display_name": "GPT-5.5",
      "status": "supported",
      "recommended": true,
      "capability_tags": ["chat", "reasoning"],
      "thinking_effort": {
        "values": [
          { "id": "default" },
          { "id": "low" },
          { "id": "high" },
          { "id": "max" }
        ],
        "default": "default"
      },
      "interface_capabilities": {
        "openai_responses": {
          "thinking_effort": {
            "mapping": {
              "default": "default",
              "low": "low",
              "high": "high",
              "max": "xhigh"
            },
            "parameter_surface": "thinking_effort",
            "adapter_policy": "map_values"
          }
        }
      }
    }
  ],
  "built_in_account_capabilities": [
    {
      "agent_id": "codex_cli",
      "display_name": "Codex CLI",
      "model_ids": ["gpt-5.5"],
      "native_interface": "codex_native",
      "provider_interface": "openai_responses",
      "binding_policy": "builtin_account_native"
    },
    {
      "agent_id": "claude_code_cli",
      "display_name": "Claude Code CLI",
      "model_ids": [],
      "native_interface": "claude_code_native",
      "provider_interface": "anthropic_compatible_messages",
      "binding_policy": "builtin_account_native"
    }
  ]
}
